18:24:12.849090 IP bcftpproxy.fnb.co.za.http-alt > seedollar-fnb.fnb.co.za.50592: Flags [P.], seq 2767952574:2767952898, ack 3752523331, win 65535, options [nop,nop,TS val 1966505022 ecr 13067212], length 324: HTTP: HTTP/1.1 200 OK
18:24:12.849145 IP seedollar-fnb.fnb.co.za.50592 > bcftpproxy.fnb.co.za.http-alt: Flags [.], ack 324, win 237, options [nop,nop,TS val 13067265 ecr 1966505022], length 0
18:24:12.853127 IP bcftpproxy.fnb.co.za.http-alt > seedollar-fnb.fnb.co.za.50596: Flags [.], ack 1283872274, win 65535, options [nop,nop,TS val 1966505032 ecr 13067250], length 0
18:24:12.912652 IP fhlu3321398d1wl.fnb.co.za.64498 > 239.255.255.250.ssdp: UDP, length 174
18:24:12.927323 IP proxytestpac.fnb.co.za.http-alt > seedollar-fnb.fnb.co.za.59244: Flags [P.], seq 504369019:504369456, ack 631624566, win 65535, options [nop,nop,TS val 1965630777 ecr 13067232], length 437: HTTP
18:24:12.927373 IP seedollar-fnb.fnb.co.za.59244 > proxytestpac.fnb.co.za.http-alt: Flags [.], ack 437, win 334, options [nop,nop,TS val 13067289 ecr 1965630777], length 0
18:24:12.973016 IP bcftpproxy.fnb.co.za.http-alt > seedollar-fnb.fnb.co.za.50596: Flags [P.], seq 0:524, ack 1, win 65535, options [nop,nop,TS val 1966505152 ecr 13067250], length 524: HTTP: HTTP/1.1 200 OK
18:24:12.973067 IP seedollar-fnb.fnb.co.za.50596 > bcftpproxy.fnb.co.za.http-alt: Flags [.], ack 524, win 237, options [nop,nop,TS val 13067303 ecr 1966505152], length 0
18:24:12.986069 IP bcftpproxy.fnb.co.za.http-alt > seedollar-fnb.fnb.co.za.50526: Flags [F.], seq 2977190361, ack 3649191351, win 65535, options [nop,nop,TS val 1966505162 ecr 13067007], length 0
18:24:12.998766 IP bcftpproxy.fnb.co.za.http-alt > seedollar-fnb.fnb.co.za.50550: Flags [P.], seq 1044437268:1044437566, ack 1741272658, win 65535, options [nop,nop,TS val 1966505172 ecr 13067237], length 298: HTTP
18:24:12.998810 IP bcftpproxy.fnb.co.za.http-alt > seedollar-fnb.fnb.co.za.50550: Flags [P.], seq 298:370, ack 1, win 65535, options [nop,nop,TS val 1966505172 ecr 13067237], length 72: HTTP
18:24:12.998844 IP seedollar-fnb.fnb.co.za.50550 > bcftpproxy.fnb.co.za.http-alt: Flags [.], ack 370, win 399, options [nop,nop,TS val 13067310 ecr 1966505172], length 0
18:24:13.025995 IP seedollar-fnb.fnb.co.za.50526 > bcftpproxy.fnb.co.za.http-alt: Flags [.], ack 1, win 355, options [nop,nop,TS val 13067319 ecr 1966505162], length 0
18:24:13.103561 IP bcftpproxy.fnb.co.za.http-alt > seedollar-fnb.fnb.co.za.50594: Flags [P.], seq 2277645290:2277646700, ack 3335727124, win 65535, options [nop,nop,TS val 1966505282 ecr 13067218], length 1410: HTTP: HTTP/1.1 200 OK
18:24:13.103609 IP seedollar-fnb.fnb.co.za.50594 > bcftpproxy.fnb.co.za.http-alt: Flags [.], ack 1410, win 251, options [nop,nop,TS val 13067342 ecr 1966505282], length 0
18:24:13.103616 IP bcftpproxy.fnb.co.za.http-alt > seedollar-fnb.fnb.co.za.50594: Flags [.], seq 1410:2758, ack 1, win 65535, options [nop,nop,TS val 1966505282 ecr 13067218], length 1348: HTTP
18:24:13.103625 IP seedollar-fnb.fnb.co.za.50594 > bcftpproxy.fnb.co.za.http-alt: Flags [.], ack 2758, win 274, options [nop,nop,TS val 13067342 ecr 1966505282], length 0
18:24:13.104828 IP bcftpproxy.fnb.co.za.http-alt > seedollar-fnb.fnb.co.za.50594: Flags [.], seq 2758:5454, ack 1, win 65535, options [nop,nop,TS val 1966505282 ecr 13067342], length 2696: HTTP
18:24:13.104868 IP seedollar-fnb.fnb.co.za.50594 > bcftpproxy.fnb.co.za.http-alt: Flags [.], ack 5454, win 316, options [nop,nop,TS val 13067342 ecr 1966505282], length 0
18:24:13.105069 IP bcftpproxy.fnb.co.za.http-alt > seedollar-fnb.fnb.co.za.50594: Flags [P.], seq 5454:7728, ack 1, win 65535, options [nop,nop,TS val 1966505282 ecr 13067342], length 2274: HTTP
18:24:13.105089 IP seedollar-fnb.fnb.co.za.50594 > bcftpproxy.fnb.co.za.http-alt: Flags [.], ack 7728, win 352, options [nop,nop,TS val 13067342 ecr 1966505282], length 0
18:24:13.118546 IP proxytestpac.fnb.co.za.http-alt > seedollar-fnb.fnb.co.za.39644: Flags [P.], seq 2233152133:2233153155, ack 65697549, win 65535, options [nop,nop,TS val 1965630967 ecr 13067246], length 1022: HTTP
18:24:13.118603 IP seedollar-fnb.fnb.co.za.39644 > proxytestpac.fnb.co.za.http-alt: Flags [.], ack 1022, win 1444, options [nop,nop,TS val 13067346 ecr 1965630967], length 0
18:24:13.174494 IP bcftpproxy.fnb.co.za.http-alt > seedollar-fnb.fnb.co.za.shaperai: Flags [P.], seq 30214663:30214696, ack 964442875, win 65535, options [nop,nop,TS val 1966505352 ecr 13067010], length 33: HTTP
18:24:13.174533 IP seedollar-fnb.fnb.co.za.shaperai > bcftpproxy.fnb.co.za.http-alt: Flags [.], ack 33, win 1444, options [nop,nop,TS val 13067363 ecr 1966505352], length 0
18:24:13.174542 IP bcftpproxy.fnb.co.za.http-alt > seedollar-fnb.fnb.co.za.shaperai: Flags [P.], seq 33:249, ack 1, win 65535, options [nop,nop,TS val 1966505352 ecr 13067010], length 216: HTTP
18:24:13.174552 IP seedollar-fnb.fnb.co.za.shaperai > bcftpproxy.fnb.co.za.http-alt: Flags [.], ack 249, win 1444, options [nop,nop,TS val 13067363 ecr 1966505352], length 0
18:24:13.178624 IP bcftpproxy.fnb.co.za.http-alt > seedollar-fnb.fnb.co.za.50590: Flags [P.], seq 122884819:122885276, ack 1914350754, win 65535, options [nop,nop,TS val 1966505352 ecr 13067211], length 457: HTTP: HTTP/1.1 304 Not Modified
18:24:13.178668 IP seedollar-fnb.fnb.co.za.50590 > bcftpproxy.fnb.co.za.http-alt: Flags [.], ack 457, win 237, options [nop,nop,TS val 13067364 ecr 1966505352], length 0
18:24:13.186542 IP seedollar-fnb.fnb.co.za.50584 > bcftpproxy.fnb.co.za.http-alt: Flags [F.], seq 4053070228, ack 76029025, win 245, options [nop,nop,TS val 13067367 ecr 1966504992], length 0
18:24:13.186722 IP seedollar-fnb.fnb.co.za.50598 > bcftpproxy.fnb.co.za.http-alt: Flags [S], seq 2785339196, win 29200, options [mss 1460,sackOK,TS val 13067367 ecr 0,nop,wscale 7], length 0
18:24:13.187459 IP bcftpproxy.fnb.co.za.http-alt > seedollar-fnb.fnb.co.za.50584: Flags [.], ack 1, win 65535, options [nop,nop,TS val 1966505362 ecr 13067367], length 0
18:24:13.187480 IP bcftpproxy.fnb.co.za.http-alt > seedollar-fnb.fnb.co.za.50584: Flags [F.], seq 1, ack 1, win 65535, options [nop,nop,TS val 1966505362 ecr 13067367], length 0
18:24:13.187495 IP seedollar-fnb.fnb.co.za.50584 > bcftpproxy.fnb.co.za.http-alt: Flags [.], ack 2, win 245, options [nop,nop,TS val 13067367 ecr 1966505362], length 0
18:24:13.187497 IP bcftpproxy.fnb.co.za.http-alt > seedollar-fnb.fnb.co.za.50598: Flags [S.], seq 2399692302, ack 2785339197, win 65535, options [mss 1460,sackOK,TS val 1966505362 ecr 13067367,wscale 0,eol], length 0
18:24:13.187509 IP seedollar-fnb.fnb.co.za.50598 > bcftpproxy.fnb.co.za.http-alt: Flags [.], ack 1, win 229, options [nop,nop,TS val 13067367 ecr 1966505362], length 0
18:24:13.187634 IP seedollar-fnb.fnb.co.za.50598 > bcftpproxy.fnb.co.za.http-alt: Flags [P.], seq 1:886, ack 1, win 229, options [nop,nop,TS val 13067367 ecr 1966505362], length 885: HTTP: GET http://animate.adobe.com/runtime/6.0.0/edge.6.0.0.min.js HTTP/1.1
18:24:13.195380 IP bcftpproxy.fnb.co.za.http-alt > seedollar-fnb.fnb.co.za.50598: Flags [P.], seq 1:411, ack 886, win 65535, options [nop,nop,TS val 1966505372 ecr 13067367], length 410: HTTP: HTTP/1.1 304 Not Modified
18:24:13.195423 IP seedollar-fnb.fnb.co.za.50598 > bcftpproxy.fnb.co.za.http-alt: Flags [.], ack 411, win 237, options [nop,nop,TS val 13067369 ecr 1966505372], length 0
18:24:13.201623 IP proxytestpac.fnb.co.za.http-alt > seedollar-fnb.fnb.co.za.57082: Flags [P.], seq 355363946:355364059, ack 1360828155, win 65535, options [nop,nop,TS val 1964806794 ecr 13067083], length 113: HTTP
18:24:13.202044 IP proxytestpac.fnb.co.za.http-alt > seedollar-fnb.fnb.co.za.57082: Flags [.], seq 113:1461, ack 1, win 65535, options [nop,nop,TS val 1964806794 ecr 13067083], length 1348: HTTP
18:24:13.202067 IP seedollar-fnb.fnb.co.za.57082 > proxytestpac.fnb.co.za.http-alt: Flags [.], ack 1461, win 251, options [nop,nop,TS val 13067371 ecr 1964806794], length 0
18:24:13.202076 IP proxytestpac.fnb.co.za.http-alt > seedollar-fnb.fnb.co.za.57082: Flags [.], seq 1461:2809, ack 1, win 65535, options [nop,nop,TS val 1964806794 ecr 13067083], length 1348: HTTP
18:24:13.202293 IP proxytestpac.fnb.co.za.http-alt > seedollar-fnb.fnb.co.za.57082: Flags [P.], seq 2809:3614, ack 1, win 65535, options [nop,nop,TS val 1964806794 ecr 13067083], length 805: HTTP
18:24:13.202306 IP seedollar-fnb.fnb.co.za.57082 > proxytestpac.fnb.co.za.http-alt: Flags [.], ack 3614, win 295, options [nop,nop,TS val 13067371 ecr 1964806794], length 0
18:24:13.203098 IP seedollar-fnb.fnb.co.za.57082 > proxytestpac.fnb.co.za.http-alt: Flags [P.], seq 1:127, ack 3614, win 295, options [nop,nop,TS val 13067372 ecr 1964806794], length 126: HTTP
18:24:13.204962 IP seedollar-fnb.fnb.co.za.57082 > proxytestpac.fnb.co.za.http-alt: Flags [P.], seq 127:1837, ack 3614, win 295, options [nop,nop,TS val 13067372 ecr 1964806794], length 1710: HTTP
18:24:13.206340 IP proxytestpac.fnb.co.za.http-alt > seedollar-fnb.fnb.co.za.57082: Flags [.], ack 1575, win 64604, options [nop,nop,TS val 1964806804 ecr 13067372], length 0
18:24:13.262926 IP proxytestpac.fnb.co.za.http-alt > seedollar-fnb.fnb.co.za.57082: Flags [.], ack 1837, win 65535, options [nop,nop,TS val 1964806864 ecr 13067372], length 0
18:24:13.262960 IP bcftpproxy.fnb.co.za.http-alt > seedollar-fnb.fnb.co.za.shaperai: Flags [P.], seq 249:313, ack 1, win 65535, options [nop,nop,TS val 1966505442 ecr 13067363], length 64: HTTP
18:24:13.262975 IP seedollar-fnb.fnb.co.za.shaperai > bcftpproxy.fnb.co.za.http-alt: Flags [.], ack 313, win 1444, options [nop,nop,TS val 13067390 ecr 1966505442], length 0
18:24:13.262980 IP bcftpproxy.fnb.co.za.http-alt > seedollar-fnb.fnb.co.za.shaperai: Flags [P.], seq 313:469, ack 1, win 65535, options [nop,nop,TS val 1966505442 ecr 13067363], length 156: HTTP
18:24:13.262985 IP seedollar-fnb.fnb.co.za.shaperai > bcftpproxy.fnb.co.za.http-alt: Flags [.], ack 469, win 1444, options [nop,nop,TS val 13067390 ecr 1966505442], length 0
18:24:13.306072 IP seedollar-fnb.fnb.co.za.50526 > bcftpproxy.fnb.co.za.http-alt: Flags [F.], seq 1, ack 1, win 355, options [nop,nop,TS val 13067403 ecr 1966505162], length 0
18:24:13.306777 IP seedollar-fnb.fnb.co.za.50390 > bcftpproxy.fnb.co.za.http-alt: Flags [P.], seq 258370261:258371121, ack 1304673080, win 318, options [nop,nop,TS val 13067403 ecr 1966489762], length 860: HTTP
18:24:13.307035 IP bcftpproxy.fnb.co.za.http-alt > seedollar-fnb.fnb.co.za.50526: Flags [.], ack 2, win 65534, options [nop,nop,TS val 1966505482 ecr 13067403], length 0
18:24:13.402784 IP bcftpproxy.fnb.co.za.http-alt > seedollar-fnb.fnb.co.za.50390: Flags [.], ack 860, win 65535, options [nop,nop,TS val 1966505582 ecr 13067403], length 0
18:24:13.418927 IP bcftpproxy.fnb.co.za.http-alt > seedollar-fnb.fnb.co.za.shaperai: Flags [P.], seq 469:500, ack 1, win 65535, options [nop,nop,TS val 1966505592 ecr 13067390], length 31: HTTP
18:24:13.418988 IP seedollar-fnb.fnb.co.za.shaperai > bcftpproxy.fnb.co.za.http-alt: Flags [.], ack 500, win 1444, options [nop,nop,TS val 13067436 ecr 1966505592], length 0
18:24:13.419469 IP proxytestpac.fnb.co.za.http-alt > seedollar-fnb.fnb.co.za.39644: Flags [P.], seq 1022:2038, ack 1, win 65535, options [nop,nop,TS val 1965631267 ecr 13067346], length 1016: HTTP
18:24:13.419485 IP seedollar-fnb.fnb.co.za.39644 > proxytestpac.fnb.co.za.http-alt: Flags [.], ack 2038, win 1444, options [nop,nop,TS val 13067437 ecr 1965631267], length 0
18:24:13.443793 IP seedollar-fnb.fnb.co.za.50596 > bcftpproxy.fnb.co.za.http-alt: Flags [P.], seq 1:1153, ack 524, win 237, options [nop,nop,TS val 13067444 ecr 1966505152], length 1152: HTTP: GET http://pagead2.googlesyndication.com/activeview?avi=Bq7d9tWDEV6WKBJHFb-6HlSAAAAAAEAE4AcgBCcACAuACAOAEAaAGFg&cid=CAASFeRoLPkBmyNfjRSm1ZPzKyy0Y6DOIg&id=osdim&ti=1&adk=1704816217&p=480,383,1080,683&tos=0,1151,0,0,0&mtos=0,1151,1151,1151,1151&rs=3&ht=0&tfs=1576&tls=2727&mc=0.85&lte=0.85&bas=0&bac=0&fp=correlator%3D2275691019554850%26eid%3D108809080%252C108809112%26iu%3D%252F5262%252Fmarkets%252Fstocks%26oid%3D3%26url%3Dhttp%253A%252F%252Fwww.bloomberg.com%252Fquote%252FUSDZAR%253ACUR&afp=%26output%3Djson_html%26impl%3Dfif%26dt%3D1472487850519%26adx%3D373%26ady%3D470%26ifi%3D2%26flash%3D0&r=u&bs=1905,990&bos=1920,990&ps=1905,2636&ss=1920,1080&tt=2728&pt=-1&deb=1-0-4-7-9--1&tvt=1723&uc=5&tgt=nf&cl=0 HTTP/1.1
18:24:13.447604 IP proxytestpac.fnb.co.za.http-alt > seedollar-fnb.fnb.co.za.57082: Flags [P.], seq 3614:3665, ack 1837, win 65535, options [nop,nop,TS val 1964807044 ecr 13067372], length 51: HTTP
18:24:13.449012 IP proxytestpac.fnb.co.za.http-alt > seedollar-fnb.fnb.co.za.57082: Flags [P.], seq 3665:4053, ack 1837, win 65535, options [nop,nop,TS val 1964807044 ecr 13067372], length 388: HTTP
18:24:13.449044 IP seedollar-fnb.fnb.co.za.57082 > proxytestpac.fnb.co.za.http-alt: Flags [.], ack 4053, win 316, options [nop,nop,TS val 13067445 ecr 1964807044], length 0
18:24:13.450811 IP seedollar-fnb.fnb.co.za.51810 > iss-fnbflsdc01.fnb.co.za.domain: 59406+ A? proxyo.fnb.co.za. (34)
18:24:13.451656 IP iss-fnbflsdc01.fnb.co.za.domain > seedollar-fnb.fnb.co.za.51810: 59406* 3/0/0 A 172.28.11.137, A 172.28.11.135, A 172.28.11.134 (82)
18:24:13.451816 IP seedollar-fnb.fnb.co.za.57104 > proxytestpac.fnb.co.za.http-alt: Flags [S], seq 2543278103, win 29200, options [mss 1460,sackOK,TS val 13067446 ecr 0,nop,wscale 7], length 0
18:24:13.452364 IP seedollar-fnb.fnb.co.za.50592 > bcftpproxy.fnb.co.za.http-alt: Flags [F.], seq 1, ack 324, win 237, options [nop,nop,TS val 13067446 ecr 1966505022], length 0
18:24:13.452567 IP seedollar-fnb.fnb.co.za.33670 > iss-fnbflsdc01.fnb.co.za.domain: 32646+ A? proxyo.fnb.co.za. (34)
18:24:13.452602 IP proxytestpac.fnb.co.za.http-alt > seedollar-fnb.fnb.co.za.57104: Flags [S.], seq 2019203545, ack 2543278104, win 65535, options [mss 1460,sackOK,TS val 1964807054 ecr 13067446,wscale 0,eol], length 0
18:24:13.452631 IP seedollar-fnb.fnb.co.za.57104 > proxytestpac.fnb.co.za.http-alt: Flags [.], ack 1, win 229, options [nop,nop,TS val 13067447 ecr 1964807054], length 0
18:24:13.452748 IP seedollar-fnb.fnb.co.za.57104 > proxytestpac.fnb.co.za.http-alt: Flags [P.], seq 1:911, ack 1, win 229, options [nop,nop,TS val 13067447 ecr 1964807054], length 910: HTTP: GET http://cdn.taboola.com/libtrc/bloomberg/loader.js HTTP/1.1
18:24:13.453220 IP iss-fnbflsdc01.fnb.co.za.domain > seedollar-fnb.fnb.co.za.33670: 32646* 3/0/0 A 172.28.11.135, A 172.28.11.134, A 172.28.11.137 (82)
18:24:13.453232 IP bcftpproxy.fnb.co.za.http-alt > seedollar-fnb.fnb.co.za.50592: Flags [.], ack 2, win 65535, options [nop,nop,TS val 1966505632 ecr 13067446], length 0
18:24:13.453248 IP bcftpproxy.fnb.co.za.http-alt > seedollar-fnb.fnb.co.za.50592: Flags [F.], seq 324, ack 2, win 65535, options [nop,nop,TS val 1966505632 ecr 13067446], length 0
18:24:13.453264 IP seedollar-fnb.fnb.co.za.50592 > bcftpproxy.fnb.co.za.http-alt: Flags [.], ack 325, win 237, options [nop,nop,TS val 13067447 ecr 1966505632], length 0
18:24:13.453396 IP seedollar-fnb.fnb.co.za.59298 > proxytestpac.fnb.co.za.http-alt: Flags [S], seq 1724675419, win 29200, options [mss 1460,sackOK,TS val 13067447 ecr 0,nop,wscale 7], length 0
18:24:13.454238 IP proxytestpac.fnb.co.za.http-alt > seedollar-fnb.fnb.co.za.59298: Flags [S.], seq 66794565, ack 1724675420, win 65535, options [mss 1460,sackOK,TS val 1965631307 ecr 13067447,wscale 0,eol], length 0
18:24:13.454259 IP seedollar-fnb.fnb.co.za.59298 > proxytestpac.fnb.co.za.http-alt: Flags [.], ack 1, win 229, options [nop,nop,TS val 13067447 ecr 1965631307], length 0
18:24:13.454378 IP seedollar-fnb.fnb.co.za.59298 > proxytestpac.fnb.co.za.http-alt: Flags [P.], seq 1:461, ack 1, win 229, options [nop,nop,TS val 13067447 ecr 1965631307], length 460: HTTP: GET http://js.bizographics.com/insight.min.js HTTP/1.1
18:24:13.470988 IP seedollar-fnb.fnb.co.za.50598 > bcftpproxy.fnb.co.za.http-alt: Flags [F.], seq 886, ack 411, win 237, options [nop,nop,TS val 13067452 ecr 1966505372], length 0
18:24:13.471254 IP seedollar-fnb.fnb.co.za.52993 > iss-fnbflsdc01.fnb.co.za.domain: 34508+ A? proxyo.fnb.co.za. (34)
18:24:13.471304 IP seedollar-fnb.fnb.co.za.50590 > bcftpproxy.fnb.co.za.http-alt: Flags [F.], seq 1, ack 457, win 237, options [nop,nop,TS val 13067452 ecr 1966505352], length 0
18:24:13.471947 IP bcftpproxy.fnb.co.za.http-alt > seedollar-fnb.fnb.co.za.50598: Flags [.], ack 887, win 65535, options [nop,nop,TS val 1966505642 ecr 13067452], length 0
18:24:13.471972 IP iss-fnbflsdc01.fnb.co.za.domain > seedollar-fnb.fnb.co.za.52993: 34508* 3/0/0 A 172.28.11.134, A 172.28.11.137, A 172.28.11.135 (82)
18:24:13.471982 IP bcftpproxy.fnb.co.za.http-alt > seedollar-fnb.fnb.co.za.50598: Flags [F.], seq 411, ack 887, win 65535, options [nop,nop,TS val 1966505642 ecr 13067452], length 0
18:24:13.471992 IP seedollar-fnb.fnb.co.za.50598 > bcftpproxy.fnb.co.za.http-alt: Flags [.], ack 412, win 237, options [nop,nop,TS val 13067452 ecr 1966505642], length 0
18:24:13.472120 IP seedollar-fnb.fnb.co.za.50604 > bcftpproxy.fnb.co.za.http-alt: Flags [S], seq 2114179567, win 29200, options [mss 1460,sackOK,TS val 13067452 ecr 0,nop,wscale 7], length 0
18:24:13.472148 IP seedollar-fnb.fnb.co.za.50606 > bcftpproxy.fnb.co.za.http-alt: Flags [S], seq 797520709, win 29200, options [mss 1460,sackOK,TS val 13067452 ecr 0,nop,wscale 7], length 0
18:24:13.472248 IP bcftpproxy.fnb.co.za.http-alt > seedollar-fnb.fnb.co.za.50590: Flags [.], ack 2, win 65535, options [nop,nop,TS val 1966505642 ecr 13067452], length 0
18:24:13.472256 IP bcftpproxy.fnb.co.za.http-alt > seedollar-fnb.fnb.co.za.50590: Flags [F.], seq 457, ack 2, win 65535, options [nop,nop,TS val 1966505642 ecr 13067452], length 0
18:24:13.472263 IP seedollar-fnb.fnb.co.za.50590 > bcftpproxy.fnb.co.za.http-alt: Flags [.], ack 458, win 237, options [nop,nop,TS val 13067452 ecr 1966505642], length 0
18:24:13.473103 IP bcftpproxy.fnb.co.za.http-alt > seedollar-fnb.fnb.co.za.50606: Flags [S.], seq 1405090678, ack 797520710, win 65535, options [mss 1460,sackOK,TS val 1966505652 ecr 13067452,wscale 0,eol], length 0
18:24:13.473118 IP seedollar-fnb.fnb.co.za.50606 > bcftpproxy.fnb.co.za.http-alt: Flags [.], ack 1, win 229, options [nop,nop,TS val 13067453 ecr 1966505652], length 0
18:24:13.473121 IP bcftpproxy.fnb.co.za.http-alt > seedollar-fnb.fnb.co.za.50604: Flags [S.], seq 2922073276, ack 2114179568, win 65535, options [mss 1460,sackOK,TS val 1966505652 ecr 13067452,wscale 0,eol], length 0
18:24:13.473126 IP seedollar-fnb.fnb.co.za.50604 > bcftpproxy.fnb.co.za.http-alt: Flags [.], ack 1, win 229, options [nop,nop,TS val 13067453 ecr 1966505652], length 0
18:24:13.473254 IP seedollar-fnb.fnb.co.za.50606 > bcftpproxy.fnb.co.za.http-alt: Flags [P.], seq 1:1010, ack 1, win 229, options [nop,nop,TS val 13067453 ecr 1966505652], length 1009: HTTP: GET http://cdn.krxd.net/userdata/get?pub=0ccccb05-8c21-4099-9838-fed4ceb7a239&callback=Krux.ns._default.kxjsonp_userdata HTTP/1.1
18:24:13.473298 IP seedollar-fnb.fnb.co.za.50604 > bcftpproxy.fnb.co.za.http-alt: Flags [P.], seq 1:978, ack 1, win 229, options [nop,nop,TS val 13067453 ecr 1966505652], length 977: HTTP: GET http://beacon.krxd.net/optout_check?callback=Krux.ns._default.kxjsonp_optOutCheck HTTP/1.1
18:24:13.502899 IP bcftpproxy.fnb.co.za.http-alt > seedollar-fnb.fnb.co.za.50596: Flags [.], ack 1153, win 65535, options [nop,nop,TS val 1966505682 ecr 13067444], length 0
18:24:13.503181 IP seedollar-fnb.fnb.co.za.50594 > bcftpproxy.fnb.co.za.http-alt: Flags [F.], seq 1, ack 7728, win 352, options [nop,nop,TS val 13067462 ecr 1966505282], length 0
18:24:13.503427 IP seedollar-fnb.fnb.co.za.48525 > iss-fnbflsdc01.fnb.co.za.domain: 43104+ A? proxyo.fnb.co.za. (34)
18:24:13.504106 IP bcftpproxy.fnb.co.za.http-alt > seedollar-fnb.fnb.co.za.50594: Flags [.], ack 2, win 65535, options [nop,nop,TS val 1966505682 ecr 13067462], length 0
18:24:13.504123 IP bcftpproxy.fnb.co.za.http-alt > seedollar-fnb.fnb.co.za.50594: Flags [F.], seq 7728, ack 2, win 65535, options [nop,nop,TS val 1966505682 ecr 13067462], length 0
18:24:13.504135 IP seedollar-fnb.fnb.co.za.50594 > bcftpproxy.fnb.co.za.http-alt: Flags [.], ack 7729, win 352, options [nop,nop,TS val 13067462 ecr 1966505682], length 0
18:24:13.504138 IP iss-fnbflsdc01.fnb.co.za.domain > seedollar-fnb.fnb.co.za.48525: 43104* 3/0/0 A 172.28.11.137, A 172.28.11.135, A 172.28.11.134 (82)
18:24:13.504271 IP seedollar-fnb.fnb.co.za.57112 > proxytestpac.fnb.co.za.http-alt: Flags [S], seq 3785383762, win 29200, options [mss 1460,sackOK,TS val 13067462 ecr 0,nop,wscale 7], length 0
18:24:13.505050 IP proxytestpac.fnb.co.za.http-alt > seedollar-fnb.fnb.co.za.57112: Flags [S.], seq 995826396, ack 3785383763, win 65535, options [mss 1460,sackOK,TS val 1964807104 ecr 13067462,wscale 0,eol], length 0
18:24:13.505072 IP seedollar-fnb.fnb.co.za.57112 > proxytestpac.fnb.co.za.http-alt: Flags [.], ack 1, win 229, options [nop,nop,TS val 13067462 ecr 1964807104], length 0
18:24:13.505210 IP seedollar-fnb.fnb.co.za.57112 > proxytestpac.fnb.co.za.http-alt: Flags [P.], seq 1:871, ack 1, win 229, options [nop,nop,TS val 13067462 ecr 1964807104], length 870: HTTP: GET http://apex.go.sonobi.com/trinity.js?key_maker={%221%22:%22451c22e3bcd2ead2744b%22,%222%22:%2267ea8e368335bf2d588d%22} HTTP/1.1
18:24:13.512117 IP proxytestpac.fnb.co.za.http-alt > seedollar-fnb.fnb.co.za.57104: Flags [.], ack 911, win 65535, options [nop,nop,TS val 1964807114 ecr 13067447], length 0
18:24:13.512524 IP seedollar-fnb.fnb.co.za.50586 > bcftpproxy.fnb.co.za.http-alt: Flags [F.], seq 734856483, ack 734961512, win 300, options [nop,nop,TS val 13067464 ecr 1966504862], length 0
18:24:13.512663 IP seedollar-fnb.fnb.co.za.50340 > bcftpproxy.fnb.co.za.http-alt: Flags [F.], seq 3678278378, ack 2736767666, win 275, options [nop,nop,TS val 13067465 ecr 1966490512], length 0
18:24:13.512745 IP seedollar-fnb.fnb.co.za.54319 > iss-fnbflsdc01.fnb.co.za.domain: 57154+ A? proxyo.fnb.co.za. (34)
18:24:13.512752 IP seedollar-fnb.fnb.co.za.59244 > proxytestpac.fnb.co.za.http-alt: Flags [F.], seq 1, ack 437, win 334, options [nop,nop,TS val 13067465 ecr 1965630777], length 0
18:24:13.512845 IP seedollar-fnb.fnb.co.za.57062 > proxytestpac.fnb.co.za.http-alt: Flags [F.], seq 1818683632, ack 2997187698, win 1921, options [nop,nop,TS val 13067465 ecr 1964804694], length 0
18:24:13.513442 IP bcftpproxy.fnb.co.za.http-alt > seedollar-fnb.fnb.co.za.50586: Flags [.], ack 1, win 65535, options [nop,nop,TS val 1966505692 ecr 13067464], length 0
18:24:13.513461 IP bcftpproxy.fnb.co.za.http-alt > seedollar-fnb.fnb.co.za.50586: Flags [F.], seq 1, ack 1, win 65535, options [nop,nop,TS val 1966505692 ecr 13067464], length 0
18:24:13.513474 IP seedollar-fnb.fnb.co.za.50586 > bcftpproxy.fnb.co.za.http-alt: Flags [.], ack 2, win 300, options [nop,nop,TS val 13067465 ecr 1966505692], length 0
18:24:13.513477 IP iss-fnbflsdc01.fnb.co.za.domain > seedollar-fnb.fnb.co.za.54319: 57154* 3/0/0 A 172.28.11.135, A 172.28.11.134, A 172.28.11.137 (82)
18:24:13.513483 IP proxytestpac.fnb.co.za.http-alt > seedollar-fnb.fnb.co.za.59244: Flags [.], ack 2, win 65535, options [nop,nop,TS val 1965631367 ecr 13067465], length 0
18:24:13.513489 IP proxytestpac.fnb.co.za.http-alt > seedollar-fnb.fnb.co.za.59244: Flags [F.], seq 437, ack 2, win 65535, options [nop,nop,TS val 1965631367 ecr 13067465], length 0
18:24:13.513493 IP seedollar-fnb.fnb.co.za.59244 > proxytestpac.fnb.co.za.http-alt: Flags [.], ack 438, win 334, options [nop,nop,TS val 13067465 ecr 1965631367], length 0
18:24:13.513495 IP bcftpproxy.fnb.co.za.http-alt > seedollar-fnb.fnb.co.za.50340: Flags [.], ack 1, win 65535, options [nop,nop,TS val 1966505692 ecr 13067465], length 0
18:24:13.513500 IP bcftpproxy.fnb.co.za.http-alt > seedollar-fnb.fnb.co.za.50340: Flags [F.], seq 1, ack 1, win 65535, options [nop,nop,TS val 1966505692 ecr 13067465], length 0
18:24:13.513503 IP seedollar-fnb.fnb.co.za.50340 > bcftpproxy.fnb.co.za.http-alt: Flags [.], ack 2, win 275, options [nop,nop,TS val 13067465 ecr 1966505692], length 0
18:24:13.513609 IP seedollar-fnb.fnb.co.za.59306 > proxytestpac.fnb.co.za.http-alt: Flags [S], seq 3020434113, win 29200, options [mss 1460,sackOK,TS val 13067465 ecr 0,nop,wscale 7], length 0
18:24:13.513641 IP seedollar-fnb.fnb.co.za.59308 > proxytestpac.fnb.co.za.http-alt: Flags [S], seq 3138550348, win 29200, options [mss 1460,sackOK,TS val 13067465 ecr 0,nop,wscale 7], length 0
18:24:13.513666 IP seedollar-fnb.fnb.co.za.59310 > proxytestpac.fnb.co.za.http-alt: Flags [S], seq 3025499784, win 29200, options [mss 1460,sackOK,TS val 13067465 ecr 0,nop,wscale 7], length 0
18:24:13.513689 IP seedollar-fnb.fnb.co.za.59312 > proxytestpac.fnb.co.za.http-alt: Flags [S], seq 2237332923, win 29200, options [mss 1460,sackOK,TS val 13067465 ecr 0,nop,wscale 7], length 0
18:24:13.513725 IP proxytestpac.fnb.co.za.http-alt > seedollar-fnb.fnb.co.za.57062: Flags [.], ack 1, win 65535, options [nop,nop,TS val 1964807114 ecr 13067465], length 0
18:24:13.513733 IP proxytestpac.fnb.co.za.http-alt > seedollar-fnb.fnb.co.za.57062: Flags [F.], seq 1, ack 1, win 65535, options [nop,nop,TS val 1964807114 ecr 13067465], length 0
18:24:13.513739 IP seedollar-fnb.fnb.co.za.57062 > proxytestpac.fnb.co.za.http-alt: Flags [.], ack 2, win 1921, options [nop,nop,TS val 13067465 ecr 1964807114], length 0
18:24:13.514490 IP proxytestpac.fnb.co.za.http-alt > seedollar-fnb.fnb.co.za.59306: Flags [S.], seq 2413909119, ack 3020434114, win 65535, options [mss 1460,sackOK,TS val 1965631367 ecr 13067465,wscale 0,eol], length 0
18:24:13.514513 IP seedollar-fnb.fnb.co.za.59306 > proxytestpac.fnb.co.za.http-alt: Flags [.], ack 1, win 229, options [nop,nop,TS val 13067465 ecr 1965631367], length 0
18:24:13.514517 IP proxytestpac.fnb.co.za.http-alt > seedollar-fnb.fnb.co.za.59310: Flags [S.], seq 4024553942, ack 3025499785, win 65535, options [mss 1460,sackOK,TS val 1965631367 ecr 13067465,wscale 0,eol], length 0
18:24:13.514527 IP seedollar-fnb.fnb.co.za.59310 > proxytestpac.fnb.co.za.http-alt: Flags [.], ack 1, win 229, options [nop,nop,TS val 13067465 ecr 1965631367], length 0
18:24:13.514529 IP proxytestpac.fnb.co.za.http-alt > seedollar-fnb.fnb.co.za.59308: Flags [S.], seq 407558866, ack 3138550349, win 65535, options [mss 1460,sackOK,TS val 1965631367 ecr 13067465,wscale 0,eol], length 0
18:24:13.514537 IP seedollar-fnb.fnb.co.za.59308 > proxytestpac.fnb.co.za.http-alt: Flags [.], ack 1, win 229, options [nop,nop,TS val 13067465 ecr 1965631367], length 0
18:24:13.514539 IP proxytestpac.fnb.co.za.http-alt > seedollar-fnb.fnb.co.za.59312: Flags [S.], seq 2633513509, ack 2237332924, win 65535, options [mss 1460,sackOK,TS val 1965631367 ecr 13067465,wscale 0,eol], length 0
18:24:13.514547 IP seedollar-fnb.fnb.co.za.59312 > proxytestpac.fnb.co.za.http-alt: Flags [.], ack 1, win 229, options [nop,nop,TS val 13067465 ecr 1965631367], length 0
18:24:13.514772 IP seedollar-fnb.fnb.co.za.59306 > proxytestpac.fnb.co.za.http-alt: Flags [P.], seq 1:703, ack 1, win 229, options [nop,nop,TS val 13067465 ecr 1965631367], length 702: HTTP: GET http://r.nexac.com/e/getdata.xgi?dt=br&pkey=iqbg41iqbgj68&ru=http://beacon.krxd.net/data.gif?_kuid%3DKeKg-zuh%26_kdpid%3Dafae52b8-1e27-4650-bd6a-ed7d982f5a6a%26dlxid%3D%3Cna_id%3E%26dlxdata%3D%3Cna_da%3E HTTP/1.1
18:24:13.514825 IP seedollar-fnb.fnb.co.za.59310 > proxytestpac.fnb.co.za.http-alt: Flags [P.], seq 1:703, ack 1, win 229, options [nop,nop,TS val 13067465 ecr 1965631367], length 702: HTTP: GET http://r.nexac.com/e/getdata.xgi?dt=br&pkey=iefs40iefsj26&ru=http://beacon.krxd.net/data.gif?_kuid%3DKeKg-zuh%26_kdpid%3D8da8b14d-5569-4bec-bcea-722864ee8d06%26dlxid%3D%3Cna_id%3E%26dlxdata%3D%3Cna_da%3E HTTP/1.1
18:24:13.514867 IP seedollar-fnb.fnb.co.za.59308 > proxytestpac.fnb.co.za.http-alt: Flags [P.], seq 1:703, ack 1, win 229, options [nop,nop,TS val 13067465 ecr 1965631367], length 702: HTTP: GET http://r.nexac.com/e/getdata.xgi?dt=br&pkey=iyzu39iyzud95&ru=http://beacon.krxd.net/data.gif?_kuid%3DKeKg-zuh%26_kdpid%3Dbef9f122-393d-4c45-8d8d-32d8be7ac433%26dlxid%3D%3Cna_id%3E%26dlxdata%3D%3Cna_da%3E HTTP/1.1
18:24:13.514923 IP seedollar-fnb.fnb.co.za.59312 > proxytestpac.fnb.co.za.http-alt: Flags [P.], seq 1:703, ack 1, win 229, options [nop,nop,TS val 13067465 ecr 1965631367], length 702: HTTP: GET http://r.nexac.com/e/getdata.xgi?dt=br&pkey=bckw15bckwu20&ru=http://beacon.krxd.net/data.gif?_kuid%3DKeKg-zuh%26_kdpid%3D8bf57916-aac8-4f01-a386-4baf103b3e1f%26dlxid%3D%3Cna_id%3E%26dlxdata%3D%3Cna_da%3E HTTP/1.1
18:24:13.533010 IP proxytestpac.fnb.co.za.http-alt > seedollar-fnb.fnb.co.za.59298: Flags [.], ack 461, win 65535, options [nop,nop,TS val 1965631387 ecr 13067447], length 0
18:24:13.552816 IP bcftpproxy.fnb.co.za.http-alt > seedollar-fnb.fnb.co.za.50606: Flags [.], ack 1010, win 65535, options [nop,nop,TS val 1966505732 ecr 13067453], length 0
18:24:13.552868 IP bcftpproxy.fnb.co.za.http-alt > seedollar-fnb.fnb.co.za.50604: Flags [.], ack 978, win 65535, options [nop,nop,TS val 1966505732 ecr 13067453], length 0
18:24:13.562257 IP bcftpproxy.fnb.co.za.http-alt > seedollar-fnb.fnb.co.za.50390: Flags [P.], seq 1:252, ack 860, win 65535, options [nop,nop,TS val 1966505732 ecr 13067403], length 251: HTTP
18:24:13.562286 IP bcftpproxy.fnb.co.za.http-alt > seedollar-fnb.fnb.co.za.50390: Flags [P.], seq 252:305, ack 860, win 65535, options [nop,nop,TS val 1966505732 ecr 13067403], length 53: HTTP
18:24:13.562291 IP proxytestpac.fnb.co.za.http-alt > seedollar-fnb.fnb.co.za.57112: Flags [.], ack 871, win 65535, options [nop,nop,TS val 1964807164 ecr 13067462], length 0
18:24:13.562328 IP seedollar-fnb.fnb.co.za.50390 > bcftpproxy.fnb.co.za.http-alt: Flags [.], ack 305, win 339, options [nop,nop,TS val 13067479 ecr 1966505732], length 0
18:24:13.569303 IP proxytestpac.fnb.co.za.http-alt > seedollar-fnb.fnb.co.za.57104: Flags [P.], seq 1:1376, ack 911, win 65535, options [nop,nop,TS val 1964807164 ecr 13067447], length 1375: HTTP: HTTP/1.1 200 OK
18:24:13.569333 IP seedollar-fnb.fnb.co.za.57104 > proxytestpac.fnb.co.za.http-alt: Flags [.], ack 1376, win 251, options [nop,nop,TS val 13067482 ecr 1964807164], length 0
18:24:13.569342 IP proxytestpac.fnb.co.za.http-alt > seedollar-fnb.fnb.co.za.57104: Flags [.], seq 1376:2724, ack 911, win 65535, options [nop,nop,TS val 1964807164 ecr 13067447], length 1348: HTTP
18:24:13.569357 IP seedollar-fnb.fnb.co.za.57104 > proxytestpac.fnb.co.za.http-alt: Flags [.], ack 2724, win 274, options [nop,nop,TS val 13067482 ecr 1964807164], length 0
18:24:13.569543 IP proxytestpac.fnb.co.za.http-alt > seedollar-fnb.fnb.co.za.57104: Flags [.], seq 2724:4072, ack 911, win 65535, options [nop,nop,TS val 1964807164 ecr 13067447], length 1348: HTTP
18:24:13.569558 IP seedollar-fnb.fnb.co.za.57104 > proxytestpac.fnb.co.za.http-alt: Flags [.], ack 4072, win 296, options [nop,nop,TS val 13067482 ecr 1964807164], length 0
18:24:13.570419 IP proxytestpac.fnb.co.za.http-alt > seedollar-fnb.fnb.co.za.57104: Flags [.], seq 4072:6768, ack 911, win 65535, options [nop,nop,TS val 1964807164 ecr 13067482], length 2696: HTTP
18:24:13.570429 IP seedollar-fnb.fnb.co.za.57104 > proxytestpac.fnb.co.za.http-alt: Flags [.], ack 6768, win 339, options [nop,nop,TS val 13067482 ecr 1964807164], length 0
18:24:13.570670 IP proxytestpac.fnb.co.za.http-alt > seedollar-fnb.fnb.co.za.57104: Flags [.], seq 6768:9464, ack 911, win 65535, options [nop,nop,TS val 1964807164 ecr 13067482], length 2696: HTTP
18:24:13.570677 IP seedollar-fnb.fnb.co.za.57104 > proxytestpac.fnb.co.za.http-alt: Flags [.], ack 9464, win 381, options [nop,nop,TS val 13067482 ecr 1964807164], length 0
18:24:13.570920 IP proxytestpac.fnb.co.za.http-alt > seedollar-fnb.fnb.co.za.57104: Flags [.], seq 9464:12160, ack 911, win 65535, options [nop,nop,TS val 1964807164 ecr 13067482], length 2696: HTTP
18:24:13.570927 IP seedollar-fnb.fnb.co.za.57104 > proxytestpac.fnb.co.za.http-alt: Flags [.], ack 12160, win 423, options [nop,nop,TS val 13067482 ecr 1964807164], length 0
18:24:13.571486 IP proxytestpac.fnb.co.za.http-alt > seedollar-fnb.fnb.co.za.57104: Flags [.], seq 12160:14856, ack 911, win 65535, options [nop,nop,TS val 1964807164 ecr 13067482], length 2696: HTTP
18:24:13.571504 IP seedollar-fnb.fnb.co.za.57104 > proxytestpac.fnb.co.za.http-alt: Flags [.], ack 14856, win 465, options [nop,nop,TS val 13067482 ecr 1964807164], length 0
18:24:13.571733 IP proxytestpac.fnb.co.za.http-alt > seedollar-fnb.fnb.co.za.57104: Flags [.], seq 14856:16204, ack 911, win 65535, options [nop,nop,TS val 1964807164 ecr 13067482], length 1348: HTTP
18:24:13.571755 IP seedollar-fnb.fnb.co.za.57104 > proxytestpac.fnb.co.za.http-alt: Flags [.], ack 16204, win 488, options [nop,nop,TS val 13067482 ecr 1964807164], length 0
18:24:13.571758 IP proxytestpac.fnb.co.za.http-alt > seedollar-fnb.fnb.co.za.57104: Flags [.], seq 16204:17552, ack 911, win 65535, options [nop,nop,TS val 1964807164 ecr 13067482], length 1348: HTTP
18:24:13.571762 IP seedollar-fnb.fnb.co.za.57104 > proxytestpac.fnb.co.za.http-alt: Flags [.], ack 17552, win 510, options [nop,nop,TS val 13067482 ecr 1964807164], length 0
18:24:13.572004 IP proxytestpac.fnb.co.za.http-alt > seedollar-fnb.fnb.co.za.57104: Flags [.], seq 17552:20248, ack 911, win 65535, options [nop,nop,TS val 1964807164 ecr 13067482], length 2696: HTTP
18:24:13.572014 IP seedollar-fnb.fnb.co.za.57104 > proxytestpac.fnb.co.za.http-alt: Flags [.], ack 20248, win 552, options [nop,nop,TS val 13067482 ecr 1964807164], length 0
18:24:13.572233 IP proxytestpac.fnb.co.za.http-alt > seedollar-fnb.fnb.co.za.57104: Flags [.], seq 20248:22944, ack 911, win 65535, options [nop,nop,TS val 1964807164 ecr 13067482], length 2696: HTTP
18:24:13.572244 IP seedollar-fnb.fnb.co.za.57104 > proxytestpac.fnb.co.za.http-alt: Flags [.], ack 22944, win 594, options [nop,nop,TS val 13067482 ecr 1964807164], length 0
18:24:13.572493 IP proxytestpac.fnb.co.za.http-alt > seedollar-fnb.fnb.co.za.57104: Flags [.], seq 22944:24292, ack 911, win 65535, options [nop,nop,TS val 1964807164 ecr 13067482], length 1348: HTTP
18:24:13.572527 IP seedollar-fnb.fnb.co.za.57104 > proxytestpac.fnb.co.za.http-alt: Flags [.], ack 24292, win 617, options [nop,nop,TS val 13067482 ecr 1964807164], length 0
18:24:13.572532 IP proxytestpac.fnb.co.za.http-alt > seedollar-fnb.fnb.co.za.57104: Flags [.], seq 24292:25640, ack 911, win 65535, options [nop,nop,TS val 1964807174 ecr 13067482], length 1348: HTTP
18:24:13.572536 IP seedollar-fnb.fnb.co.za.57104 > proxytestpac.fnb.co.za.http-alt: Flags [.], ack 25640, win 640, options [nop,nop,TS val 13067482 ecr 1964807174], length 0
18:24:13.572736 IP proxytestpac.fnb.co.za.http-alt > seedollar-fnb.fnb.co.za.57104: Flags [.], seq 25640:28336, ack 911, win 65535, options [nop,nop,TS val 1964807174 ecr 13067482], length 2696: HTTP
18:24:13.572751 IP seedollar-fnb.fnb.co.za.57104 > proxytestpac.fnb.co.za.http-alt: Flags [.], ack 28336, win 682, options [nop,nop,TS val 13067483 ecr 1964807174], length 0
18:24:13.572979 IP proxytestpac.fnb.co.za.http-alt > seedollar-fnb.fnb.co.za.57104: Flags [.], seq 28336:31032, ack 911, win 65535, options [nop,nop,TS val 1964807174 ecr 13067482], length 2696: HTTP
18:24:13.572999 IP seedollar-fnb.fnb.co.za.57104 > proxytestpac.fnb.co.za.http-alt: Flags [.], ack 31032, win 724, options [nop,nop,TS val 13067483 ecr 1964807174], length 0
18:24:13.573237 IP proxytestpac.fnb.co.za.http-alt > seedollar-fnb.fnb.co.za.57104: Flags [.], seq 31032:33728, ack 911, win 65535, options [nop,nop,TS val 1964807174 ecr 13067482], length 2696: HTTP
18:24:13.573257 IP seedollar-fnb.fnb.co.za.57104 > proxytestpac.fnb.co.za.http-alt: Flags [.], ack 33728, win 766, options [nop,nop,TS val 13067483 ecr 1964807174], length 0
18:24:13.573479 IP proxytestpac.fnb.co.za.http-alt > seedollar-fnb.fnb.co.za.57104: Flags [.], seq 33728:36424, ack 911, win 65535, options [nop,nop,TS val 1964807174 ecr 13067482], length 2696: HTTP
18:24:13.573492 IP seedollar-fnb.fnb.co.za.57104 > proxytestpac.fnb.co.za.http-alt: Flags [.], ack 36424, win 808, options [nop,nop,TS val 13067483 ecr 1964807174], length 0
18:24:13.573725 IP proxytestpac.fnb.co.za.http-alt > seedollar-fnb.fnb.co.za.57104: Flags [.], seq 36424:39120, ack 911, win 65535, options [nop,nop,TS val 1964807174 ecr 13067482], length 2696: HTTP
18:24:13.573731 IP seedollar-fnb.fnb.co.za.57104 > proxytestpac.fnb.co.za.http-alt: Flags [.], ack 39120, win 850, options [nop,nop,TS val 13067483 ecr 1964807174], length 0
18:24:13.573735 IP proxytestpac.fnb.co.za.http-alt > seedollar-fnb.fnb.co.za.57104: Flags [.], seq 39120:40468, ack 911, win 65535, options [nop,nop,TS val 1964807174 ecr 13067483], length 1348: HTTP
18:24:13.573739 IP seedollar-fnb.fnb.co.za.57104 > proxytestpac.fnb.co.za.http-alt: Flags [.], ack 40468, win 873, options [nop,nop,TS val 13067483 ecr 1964807174], length 0
18:24:13.573974 IP proxytestpac.fnb.co.za.http-alt > seedollar-fnb.fnb.co.za.57104: Flags [.], seq 40468:41816, ack 911, win 65535, options [nop,nop,TS val 1964807174 ecr 13067483], length 1348: HTTP
18:24:13.573980 IP seedollar-fnb.fnb.co.za.57104 > proxytestpac.fnb.co.za.http-alt: Flags [.], ack 41816, win 896, options [nop,nop,TS val 13067483 ecr 1964807174], length 0
18:24:13.573982 IP proxytestpac.fnb.co.za.http-alt > seedollar-fnb.fnb.co.za.57104: Flags [.], seq 41816:43164, ack 911, win 65535, options [nop,nop,TS val 1964807174 ecr 13067483], length 1348: HTTP
18:24:13.573986 IP seedollar-fnb.fnb.co.za.57104 > proxytestpac.fnb.co.za.http-alt: Flags [.], ack 43164, win 918, options [nop,nop,TS val 13067483 ecr 1964807174], length 0
18:24:13.574224 IP proxytestpac.fnb.co.za.http-alt > seedollar-fnb.fnb.co.za.57104: Flags [.], seq 43164:45860, ack 911, win 65535, options [nop,nop,TS val 1964807174 ecr 13067483], length 2696: HTTP
18:24:13.574230 IP seedollar-fnb.fnb.co.za.57104 > proxytestpac.fnb.co.za.http-alt: Flags [.], ack 45860, win 960, options [nop,nop,TS val 13067483 ecr 1964807174], length 0
18:24:13.574473 IP proxytestpac.fnb.co.za.http-alt > seedollar-fnb.fnb.co.za.57104: Flags [.], seq 45860:48556, ack 911, win 65535, options [nop,nop,TS val 1964807174 ecr 13067483], length 2696: HTTP
18:24:13.574478 IP seedollar-fnb.fnb.co.za.57104 > proxytestpac.fnb.co.za.http-alt: Flags [.], ack 48556, win 1002, options [nop,nop,TS val 13067483 ecr 1964807174], length 0
18:24:13.574722 IP proxytestpac.fnb.co.za.http-alt > seedollar-fnb.fnb.co.za.57104: Flags [.], seq 48556:51252, ack 911, win 65535, options [nop,nop,TS val 1964807174 ecr 13067483], length 2696: HTTP
18:24:13.574728 IP seedollar-fnb.fnb.co.za.57104 > proxytestpac.fnb.co.za.http-alt: Flags [.], ack 51252, win 1045, options [nop,nop,TS val 13067483 ecr 1964807174], length 0
18:24:13.574972 IP proxytestpac.fnb.co.za.http-alt > seedollar-fnb.fnb.co.za.57104: Flags [.], seq 51252:53948, ack 911, win 65535, options [nop,nop,TS val 1964807174 ecr 13067483], length 2696: HTTP
18:24:13.574979 IP seedollar-fnb.fnb.co.za.57104 > proxytestpac.fnb.co.za.http-alt: Flags [.], ack 53948, win 1087, options [nop,nop,TS val 13067483 ecr 1964807174], length 0
18:24:13.575221 IP proxytestpac.fnb.co.za.http-alt > seedollar-fnb.fnb.co.za.57104: Flags [.], seq 53948:55296, ack 911, win 65535, options [nop,nop,TS val 1964807174 ecr 13067483], length 1348: HTTP
18:24:13.575230 IP seedollar-fnb.fnb.co.za.57104 > proxytestpac.fnb.co.za.http-alt: Flags [.], ack 55296, win 1109, options [nop,nop,TS val 13067483 ecr 1964807174], length 0
18:24:13.575234 IP proxytestpac.fnb.co.za.http-alt > seedollar-fnb.fnb.co.za.57104: Flags [.], seq 55296:57992, ack 911, win 65535, options [nop,nop,TS val 1964807174 ecr 13067483], length 2696: HTTP
18:24:13.575238 IP seedollar-fnb.fnb.co.za.57104 > proxytestpac.fnb.co.za.http-alt: Flags [.], ack 57992, win 1151, options [nop,nop,TS val 13067483 ecr 1964807174], length 0
